{
  "audience_icp_fit_id": "aif_demo_001",
  "version": "0.6.0",
  "updated_at": "2026-09-18",
  "business_context_id": "bc_demo_001",
  "positioning_offer_fit_id": "pof_demo_001",
  "research_package_id": "rp_demo_001",
  "segments": [
    {
      "segment_id": "seg_demo_primary",
      "name": "Operations leads at small service businesses",
      "description": "Demonstration segment only.",
      "evidence_status": "SUPPORTED_CANDIDATE",
      "priority": "PRIMARY",
      "roles": {
        "content_audience": true,
        "problem_holder": true,
        "user": true,
        "buyer": null,
        "decision_maker": null,
        "influencer": true,
        "champion": true,
        "blocker": false
      },
      "jobs": ["reduce repetitive operational work"],
      "problems": ["manual workflow coordination"],
      "desired_outcomes": ["less repetitive work"],
      "alternatives": ["manual process", "generic automation tools"],
      "objections": [],
      "buying_triggers": [],
      "switching_reasons": [],
      "language": [],
      "commercial_fit": {
        "problem_relevance": "HIGH",
        "buying_evidence": "UNKNOWN",
        "offer_fit": "HIGH",
        "proof_fit": "MEDIUM",
        "delivery_fit": "HIGH",
        "revenue_fit": "UNKNOWN",
        "reachability": "MEDIUM"
      },
      "supporting_claim_ids": ["claim_demo_001"],
      "supporting_voc_ids": [],
      "supporting_business_fields": ["offers[0]"],
      "contradicting_claim_ids": [],
      "unknowns": ["buyer role", "decision authority", "willingness to pay"],
      "rejection_reason": null
    },
    {
      "segment_id": "seg_demo_audience_only",
      "name": "Automation learners",
      "description": "Useful content audience but not established as buyer ICP.",
      "evidence_status": "AUDIENCE_NOT_ICP",
      "priority": "SECONDARY",
      "roles": {
        "content_audience": true,
        "problem_holder": null,
        "user": null,
        "buyer": false,
        "decision_maker": false,
        "influencer": null,
        "champion": null,
        "blocker": false
      },
      "jobs": [],
      "problems": [],
      "desired_outcomes": ["learn practical automation"],
      "alternatives": [],
      "objections": [],
      "buying_triggers": [],
      "switching_reasons": [],
      "language": [],
      "commercial_fit": {
        "problem_relevance": "UNKNOWN",
        "buying_evidence": "LOW",
        "offer_fit": "LOW",
        "proof_fit": "HIGH",
        "delivery_fit": "HIGH",
        "revenue_fit": "LOW",
        "reachability": "HIGH"
      },
      "supporting_claim_ids": [],
      "supporting_voc_ids": [],
      "supporting_business_fields": [],
      "contradicting_claim_ids": [],
      "unknowns": [],
      "rejection_reason": null
    }
  ],
  "primary_icp_ids": ["seg_demo_primary"],
  "secondary_icp_ids": [],
  "content_audience_ids": ["seg_demo_primary", "seg_demo_audience_only"],
  "audience_not_icp_ids": ["seg_demo_audience_only"],
  "rejected_segment_ids": [],
  "unknown_role_relationships": ["seg_demo_primary buyer/decision-maker relationship"],
  "research_requests": [],
  "questions_required_from_user": [],
  "safe_for_positioning": true,
  "safe_for_strategy": true
}
